{
  "format": "concretejs-project",
  "schemaVersion": 3,
  "createdAt": "2026-10-11T21:53:52.656Z",
  "metadata": {
    "name": "AISC Example 3-2",
    "description": "Plated Shearwall Example",
    "notes": ""
  },
  "units": {
    "length": "in",
    "stress": "psi",
    "force": "kip",
    "moment": "kip-ft"
  },
  "materials": [
    {
      "id": "material-1",
      "name": "fc4ksi",
      "type": "concrete",
      "strengthBasis": "normal",
      "compressiveStrengthACI": 4000,
      "stressStrain": [
        {
          "strain": -2,
          "stress": 0
        },
        {
          "strain": -1,
          "stress": -4000
        },
        {
          "strain": -0.002,
          "stress": -4000
        },
        {
          "strain": 0,
          "stress": 0
        }
      ]
    },
    {
      "id": "material-2",
      "name": "fc5ksi",
      "type": "concrete",
      "strengthBasis": "normal",
      "compressiveStrengthACI": 5000,
      "stressStrain": [
        {
          "strain": -2,
          "stress": 0
        },
        {
          "strain": -1,
          "stress": -5000
        },
        {
          "strain": -0.002,
          "stress": -5000
        },
        {
          "strain": 0,
          "stress": 0
        }
      ]
    },
    {
      "id": "material-3",
      "name": "fc6ksi",
      "type": "concrete",
      "strengthBasis": "normal",
      "compressiveStrengthACI": 6000,
      "stressStrain": [
        {
          "strain": -2,
          "stress": 0
        },
        {
          "strain": -1,
          "stress": -6000
        },
        {
          "strain": -0.002,
          "stress": -6000
        },
        {
          "strain": 0,
          "stress": 0
        }
      ]
    },
    {
      "id": "material-4",
      "name": "fce4ksi",
      "type": "concrete",
      "strengthBasis": "expected",
      "compressiveStrengthACI": 4000,
      "stressStrain": [
        {
          "strain": -2,
          "stress": 0
        },
        {
          "strain": -1,
          "stress": -5000
        },
        {
          "strain": -0.002,
          "stress": -5000
        },
        {
          "strain": 0,
          "stress": 0
        }
      ]
    },
    {
      "id": "material-5",
      "name": "fy60ksi",
      "type": "steel",
      "strengthBasis": "normal",
      "stressStrain": [
        {
          "strain": -2,
          "stress": -10
        },
        {
          "strain": -1,
          "stress": -60000
        },
        {
          "strain": -0.005,
          "stress": -60000
        },
        {
          "strain": -0.00207,
          "stress": -60000
        },
        {
          "strain": 0,
          "stress": 0
        },
        {
          "strain": 0.00207,
          "stress": 60000
        },
        {
          "strain": 0.005,
          "stress": 60000
        },
        {
          "strain": 1,
          "stress": 60000
        },
        {
          "strain": 2,
          "stress": 10
        }
      ]
    },
    {
      "id": "material-6",
      "name": "fye75ksi",
      "type": "steel",
      "strengthBasis": "expected",
      "stressStrain": [
        {
          "strain": -2,
          "stress": -10
        },
        {
          "strain": -1,
          "stress": -75000
        },
        {
          "strain": -0.005,
          "stress": -75000
        },
        {
          "strain": -0.00207,
          "stress": -60000
        },
        {
          "strain": 0,
          "stress": 0
        },
        {
          "strain": 0.00207,
          "stress": 60000
        },
        {
          "strain": 0.005,
          "stress": 75000
        },
        {
          "strain": 1,
          "stress": 75000
        },
        {
          "strain": 2,
          "stress": 10
        }
      ]
    },
    {
      "id": "material-7",
      "name": "fy80ksi",
      "type": "other",
      "strengthBasis": "normal",
      "stressStrain": [
        {
          "strain": -2,
          "stress": -10
        },
        {
          "strain": -1,
          "stress": -80000
        },
        {
          "strain": -0.005,
          "stress": -80000
        },
        {
          "strain": -0.00207,
          "stress": -80000
        },
        {
          "strain": 0,
          "stress": 0
        },
        {
          "strain": 0.00207,
          "stress": 80000
        },
        {
          "strain": 0.005,
          "stress": 80000
        },
        {
          "strain": 1,
          "stress": 80000
        },
        {
          "strain": 2,
          "stress": 10
        }
      ]
    },
    {
      "id": "material-8",
      "name": "50ksi",
      "type": "steel",
      "strengthBasis": "expected",
      "stressStrain": [
        {
          "strain": -2,
          "stress": -10
        },
        {
          "strain": -1,
          "stress": -50000
        },
        {
          "strain": -0.005,
          "stress": -50000
        },
        {
          "strain": -0.00207,
          "stress": -50000
        },
        {
          "strain": 0,
          "stress": 0
        },
        {
          "strain": 0.00207,
          "stress": 50000
        },
        {
          "strain": 0.005,
          "stress": 50000
        },
        {
          "strain": 1,
          "stress": 50000
        },
        {
          "strain": 2,
          "stress": 10
        }
      ]
    },
    {
      "id": "material-9",
      "name": "fc6ksi plastic",
      "type": "concrete",
      "strengthBasis": "normal",
      "compressiveStrengthACI": 6000,
      "stressStrain": [
        {
          "strain": -2,
          "stress": 0
        },
        {
          "strain": -1,
          "stress": -6000
        },
        {
          "strain": -0.000001,
          "stress": -6000
        },
        {
          "strain": 0,
          "stress": 0
        }
      ]
    },
    {
      "id": "material-10",
      "name": "50ksi plastic",
      "type": "steel",
      "strengthBasis": "expected",
      "stressStrain": [
        {
          "strain": -2,
          "stress": -10
        },
        {
          "strain": -1,
          "stress": -50000
        },
        {
          "strain": -0.005,
          "stress": -50000
        },
        {
          "strain": -1e-7,
          "stress": -50000
        },
        {
          "strain": 0,
          "stress": 0
        },
        {
          "strain": 0.000001,
          "stress": 50000
        },
        {
          "strain": 0.005,
          "stress": 50000
        },
        {
          "strain": 1,
          "stress": 50000
        },
        {
          "strain": 2,
          "stress": 10
        }
      ]
    }
  ],
  "concreteShapes": [
    {
      "id": "shape-1",
      "materialId": "material-9",
      "priority": 0,
      "geometry": {
        "exterior": {
          "segments": [
            {
              "type": "line",
              "from": {
                "x": 0,
                "y": -240
              },
              "to": {
                "x": 18,
                "y": -240
              }
            },
            {
              "type": "line",
              "from": {
                "x": 18,
                "y": -240
              },
              "to": {
                "x": 18,
                "y": 240
              }
            },
            {
              "type": "line",
              "from": {
                "x": 18,
                "y": 240
              },
              "to": {
                "x": 0,
                "y": 240
              }
            },
            {
              "type": "line",
              "from": {
                "x": 0,
                "y": 240
              },
              "to": {
                "x": 0,
                "y": -240
              }
            }
          ]
        },
        "openings": []
      }
    },
    {
      "id": "shape-2",
      "materialId": "material-10",
      "priority": 1,
      "geometry": {
        "exterior": {
          "segments": [
            {
              "type": "line",
              "from": {
                "x": 0,
                "y": -240
              },
              "to": {
                "x": 0.5,
                "y": -240
              }
            },
            {
              "type": "line",
              "from": {
                "x": 0.5,
                "y": -240
              },
              "to": {
                "x": 0.5,
                "y": 240
              }
            },
            {
              "type": "line",
              "from": {
                "x": 0.5,
                "y": 240
              },
              "to": {
                "x": 0,
                "y": 240
              }
            },
            {
              "type": "line",
              "from": {
                "x": 0,
                "y": 240
              },
              "to": {
                "x": 0,
                "y": -240
              }
            }
          ]
        },
        "openings": []
      }
    },
    {
      "id": "shape-3",
      "materialId": "material-10",
      "priority": 1,
      "geometry": {
        "exterior": {
          "segments": [
            {
              "type": "line",
              "from": {
                "x": 17.5,
                "y": -240
              },
              "to": {
                "x": 18,
                "y": -240
              }
            },
            {
              "type": "line",
              "from": {
                "x": 18,
                "y": -240
              },
              "to": {
                "x": 18,
                "y": 240
              }
            },
            {
              "type": "line",
              "from": {
                "x": 18,
                "y": 240
              },
              "to": {
                "x": 17.5,
                "y": 240
              }
            },
            {
              "type": "line",
              "from": {